AccountBlocked	Accidentally blocked number
AccountBlocked	account locked
AccountBlocked	Account locked
AccountBlocked	Account status blocked.
AccountBlocked	Blocked account
AccountBlocked	Can you please unblock my account?
AccountBlocked	Can't access my acct
AccountBlocked	Closed account
AccountBlocked	Good morning, my account status is saying blocked
AccountBlocked	Hi i recently changed my number it already got approved but I purchased phone time twice and my number keeps getting blocked and my SO isn't able to call me
AccountBlocked	Hi my partner isdowntow Minneapolis i have made us two different video chats which never happened now i wanna put money on his book and it wont let me put my card that my account got locked for insufficient funda how can i help him
AccountBlocked	How do i take blocking off
AccountBlocked	How do I unblock an inmate if they was blocked by phone
AccountBlocked	I added funds and my account still says blocked
AccountBlocked	I am not understanding why I got denied my video session
AccountBlocked	I had an acct with securus but I am not able fo get in
AccountBlocked	I have deleted my account and having trouble re-signing up?
AccountBlocked	I need to take my number off of another account so i can link it as my number allowed to receive calls i also need to close that old account unblock so i can receive calls
AccountBlocked	I want to know why my account is blocked
AccountBlocked	Inbound connect not setting up
AccountBlocked	Inbound connect not working
AccountBlocked	Is my account blocked
AccountBlocked	is there a way for me to see if an e message has been received
AccountBlocked	It is saying my account is blocked and I do not understand why because I am just now setting it up.
AccountBlocked	It says blocked on my account can I not add funds.
AccountBlocked	It says blocked on my account. And 0
AccountBlocked	It says my account is blocked but there is $6 on there
AccountBlocked	My account is blocked
AccountBlocked	My account is blocked and I don't know why
AccountBlocked	My account is saying block
AccountBlocked	My account is showing blocked. Can I please get assistance with that
AccountBlocked	My account not working
AccountBlocked	My account says blocked and no funds are on the account but it shows it went thru on my debit card
AccountBlocked	My account status says blocked but I have enough funds to receive phone calls. Why am I blocked and how do I fix it?
AccountBlocked	My phone account is blocked due to past bill. How do i pay it and fix ig
AccountBlocked	My phone number is blocked of the phone account wut can i do to unblock it or register for phone calls
AccountBlocked	my portal access has been turned off and it said to contact administrator
AccountBlocked	My status says blocked ?
AccountBlocked	Number blocked
AccountBlocked	trying to get into my account , keeps saying technical difficulty
AccountBlocked	Unblock account
AccountBlocked	Unblocking number
AccountBlocked	Why am I blocked.
AccountBlocked	Why does is say my account is blocked
AccountBlocked	Why does my account say blocked
AccountBlocked	Why does my account show blocked
AccountBlocked	Why is my account blocked
AccountBlocked	Why is my account closed
AccountBlocked	Why is my account showing a different number instead of the one on the profile
AccountBlocked	Why is my account status “blocked”
AccountBlocked	Why is my number blocked from my loved one calling me and it says to contact support
AccountBlocked	Why is text messaging getting blocked
AccountBlocked	Why was my account closed
AccountClose	Cancel my account
AccountClose	Close account
AccountClose	Close my account
AccountClose	Closed my account
AccountClose	Delete account
AccountClose	delete account
AccountClose	For some reason, the app is saying my account is closed
AccountClose	How can I get a account deleted
AccountClose	How do I cancel my account
AccountClose	how do i close an account
AccountClose	I have 2 different accounts. I need to delete one of them
AccountClose	I need help with getting my account closed and my phone number put on another account
AccountClose	I need to get my account reset my family member no longer use you guys anymore I have someone else to want to use this service how can I do that
AccountClose	I would like to delete this account. It does not serve the location i am looking for.
AccountClose	My account is showing closed i didn't close my account...
AccountClose	My account says closed, but I didn't close it
AccountForgotEmailAddress	Can't find my email
AccountForgotEmailAddress	Forgot email
AccountForgotEmailAddress	Forgot email used
AccountForgotEmailAddress	hello I'm trying to add money to my son account but I cant remember my account info
AccountForgotEmailAddress	Hello! I'm having troubles remembering my email and password
AccountForgotEmailAddress	i am trying to get logged in with the email i used for jpay but even when i do forgot password it says there is an error logging in
AccountForgotEmailAddress	I am trying to log in my account and can not do it. My phone number is 2407137442. can you help me pleas
AccountForgotEmailAddress	I am unsure which email my phone account is tagged to
AccountForgotEmailAddress	I forgot what email I used for my account
AccountForgotEmailAddress	I need to add funds to my video connect account
AccountForgotEmailAddress	I need to change my email
AccountForgotEmailAddress	I opened e new account forgetting i had one flr
AccountForgotEmailAddress	I would like to add a phone number to my account
AccountForgotEmailAddress	I'm trying to add money to my account to receive calls but they put the money on the wrong account
AccountForgotEmailAddress	I'm trying to sign in and it keeps telling me my email is validated
AccountForgotEmailAddress	My phone number is on another account I don't have access to. I need it on my account
AccountForgotEmailAddress	Need to schedule a visit for onsite it wo t let me when I click on schedule a visit
AccountForgotEmailAddress	Resetting my email I can't get in it anymore
AccountForgotEmailAddress	There is an account with my number but I don't know the email or
AccountForgotVerificationAnswers	forgot security questions
AccountFundsError	Payment hasn't posted
AccountFundsError	Payment not posted to account
AccountFundsError	Pending charges , money not on account
AccountGeneric	Issue with account
AccountGovernmentID	change the last name on my account
AccountGovernmentID	How can I change the information on my account
AccountGovernmentID	I am trying to change my name to match my id but it says the file is too big when I try and attach a photo of my license
AccountGovernmentID	I would like to change my customer information on my account
AccountLoginIssues	Can't access account
AccountLoginIssues	Can't login
AccountLoginIssues	Can't sign in
AccountLoginIssues	Cant sign in
AccountLoginIssues	Hello. I just created an account and it is not letting me log in. It keeps saying “username or password is invalid.”
AccountLoginIssues	how do I log into my account
AccountLoginIssues	I can't log in to my account
AccountLoginIssues	I can't login to my account
AccountLoginIssues	I can't sign in to email my inmate
AccountLoginIssues	I'd doesn't let me login
AccountLoginIssues	It keeps saying invalid username and password but Ive reset my password multiple times
AccountLoginIssues	It won't let me reset password
AccountLoginIssues	It wont let me log in ive changed my password twice qaudruaple checked spelling
AccountLoginIssues	Log on
AccountLoginIssues	Trying to retrieve an email from my brother Jpay and it is not allowing me to sign on
AccountLoginIssues	unable login
AccountLoginIssues	Will not allow me to login to account. Email address is melmlockwood@gmail.com - when I select request password it gives me a try again later message.
AccountOpen	Can't create account
AccountOpen	create account
AccountOpen	CREATE AN ACCOUNT
AccountOpen	Hi I have went to set up a account but only giving me options for United States
AccountOpen	Hi I'm trying to create an account
AccountOpen	How can I setup an account with you I am from the UK
AccountOpen	how do I open an account
AccountOpen	I am trying to create a new account.
AccountOpen	I am trying to setup an account and it is asking for my 4 digit code i dont have one
AccountOpen	I nerd to set up a prepaid calling account
AccountOpen	i want to set up email account
AccountOpen	I'm trying to create account. It tells me to agree to terms and conditions and there's nowhere for me to d
AccountOpen	I'm trying to set up an account but it's telling me that my number is not valid
AccountOpen	I'm trying to set up an email message account to talk to my boyfriend but every time I try to log in it says that the username or password is incorrect and then when I try to create an account it's saying that I already have an account and my phone number can't be used again so I need help creating my account for iMessaging
AccountOpen	I've set a visit up on my account I didn't attend too is there any way I can reset the visit
AccountOpen	set up account over phone can't make an online account now
AccountOpen	Unable to create an account
AccountOpen	Why can't I make a account
AccountOpenError	Error with advance account signup
AccountOpenError	Hi i tried to make an account and it's not letting me create one
AccountOpenError	I am trying to create an account but it keep saying my phone number is already in use and I only had my phone number for 2 years
AccountOpenError	I am trying to create an account but it won't let me.
AccountOpenError	I am unable to set up an account although I have tried repeatedly. When I reach the end of the process and press SUBMIT, the screen goes blank and stays that way.
AccountOpenError	I can't create an account to set up on-site visitation. It won't verify my phone number. I was able to do this before I got my new phone. Is my phone number verification linked with my Google account? If so, my phone number is incorrect on there too, and I can't fix that either.
AccountOpenError	I can't make an online account it keeps asking me to call
AccountOpenError	I deleted my account and im trying to make a new one but it's asking for a 4 digit passcode and i dont know it
AccountOpenError	I got an error message when trying to set up my account
AccountOpenError	i keep getting a error mess when i try to create a account
AccountOpenError	I try to create an account and it says my number is already used. I haven't used this service before
AccountOpenError	I'm try to create an account but it says my number already exists with an open account
AccountOpenError	I'm trying to create a account but no one is answering the phone and online just telling me I have to call the number
AccountOpenError	I'm trying to create an account but my number is already added so it won't let me create an account
AccountOpenError	I'm trying to create an acct. but when I click to submit I keep getting in error message stating that I need to enter a correct telephone number but I am.
AccountOpenError	im trying to setup account and getting errors
AccountPasswordReset	can't log in
AccountPasswordReset	Can't login or reset password
AccountPasswordReset	card on file
AccountPasswordReset	Forgot My Password
AccountPasswordReset	Hey I'm trying to get into my account but it's saying that invalid username or password so I'm confused why it won't let Mr into ny account
AccountPasswordReset	Hi it's not letting me login
AccountPasswordReset	How do I get a passcode
AccountPasswordReset	How to I reset my password
AccountPasswordReset	I am unable get in old account can I reset it
AccountPasswordReset	I can't log in
AccountPasswordReset	I can't login
AccountPasswordReset	I can't remember my password - you sent me a knew password, but I can't remember my email password either.
AccountPasswordReset	I created an account but am unable t o log in to fund my phone number
AccountPasswordReset	I don't remember my login information
AccountPasswordReset	I forgot my JPay password
AccountPasswordReset	I need my password reset I called but they never sent the link I can't log into that email no more my name is Destiny Jeffrey phone number 863-358-7223-10. 1126. I have a visitation upcoming for frostproof I can't login
AccountPasswordReset	I need to log into my account
AccountPasswordReset	I need to recover my account login and password
AccountPasswordReset	im having troubles logging into my account
AccountPasswordReset	its saying i cant make a account because my number is already in the system
AccountPasswordReset	Logging in
AccountPasswordReset	Login hacked account
AccountPasswordReset	My account says I'm entering the wrong information and I know I'm not
AccountPasswordReset	My account won't let me longin at all. Even with a new password
AccountPasswordReset	My password is not working & y'all send me a generated password and it still ain't working
AccountPasswordReset	My password is not working and I literally just made this account tf
AccountPasswordReset	Reactivate my advanced connection account
AccountPasswordReset	Reset password
AccountPasswordReset	Saying invalid login but everything is correct
AccountPasswordReset	securus but I'm not able to get in. Reset password and still not working. Help!
AccountPasswordReset	sophia mcmillan inmate# 53378 has a recording when she calls out from last time she was incarcerated that needs deleted how to do that?
AccountPasswordReset	Trying to login to old account
AccountPasswordReset	Username and password correct, still giving me an error and can't log in. I've reset password, the password from Securus doesn't work either
AccountProfileChange	Added the wrong facility
AccountProfileChange	Can I Update billing address?
AccountProfileChange	Change last name
AccountProfileChange	Change last name spelling on account
AccountProfileChange	change my email
AccountProfileChange	Change my last name
AccountProfileChange	Change my main number
AccountProfileChange	Change my name and phone number
AccountProfileChange	Change number
AccountProfileChange	change phone number on my account
AccountProfileChange	Change phone number on my profile & get updated with funds applied.
AccountProfileChange	change profile information
AccountProfileChange	Change too advance connect
AccountProfileChange	Changing contact phone number
AccountProfileChange	Changing email address
AccountProfileChange	Changing name on account
AccountProfileChange	Good afternoon. I mispelled my name when I opened my account apparently and it wont let me change it.
AccountProfileChange	hello im looking to update my phone number
AccountProfileChange	HOW CAN I CHANGE MY NAME ON MY SECURUS ACCT?
AccountProfileChange	How can I change the eemaill sddress I used to sign up??
AccountProfileChange	How do I update my email address
AccountProfileChange	How to change name on account
AccountProfileChange	I am trying to change my name and everything on here
AccountProfileChange	I can't add a contact for emessage
AccountProfileChange	I just need I just need the phone number changed on my account on my profile the number that is accurate and needs to be used is 509-319-7009 I just want to make sure that's the number that I just added money on for inmate to call me cuz on my profile it's still listed as the other number
AccountProfileChange	I need to change me phone number.
AccountProfileChange	I need to change my email address
AccountProfileChange	I need to change my first name on the account
AccountProfileChange	I need to change my number
AccountProfileChange	I need to change my number and download app
AccountProfileChange	I need to change my number on my account so i can receive calls
AccountProfileChange	I need to change my phone number
accountprofilechange	I need to change the phone number connected to my account.
AccountProfileChange	I need to fix my account profile info. My last name is spelled wrong.
AccountProfileChange	I need to update my account information
AccountProfileChange	I need to update my contact information.
AccountProfileChange	I need to update my email
AccountProfileChange	I need to update my email and number.
AccountProfileChange	I need to update my phone number
AccountProfileChange	misspeled my last name
AccountProfileChange	My contact information
AccountProfileChange	need to change email address on account
AccountProfileChange	Need to change last name
AccountProfileChange	Need to change name on account
AccountProfileChange	Need to change the name on my account
AccountProfileChange	Need to unblock number
AccountProfileChange	On emessaging my name isn't Erma. My profile says my actual name (Senaida) how do I change that?
AccountProfileChange	update email
AccountProfileChange	Update name and address on account
AccountProfileChange	Update number
AccountProfileChange	update phone number
AccountRegisterAttorney	Attorney
AccountFundsAdd	I need help adding money to a inmate account
AccountReopen	I am trying to get my acct back open again
AccountReopen	Open my account back up
AccountReopen	Reopen a closed account
AccountReopen	reopening my accounts
AccountTypeQuestion	Account sign in information
AccountTypeQuestion	Can I have two different accounts under my account so I can add money to two different incarnations
AccountTypeQuestion	Forgot account information
AccountTypeQuestion	How can i fund a new inmate debit account
AccountTypeQuestion	I have bn calling the number cant get an actual person, need an account number
AccountTypeQuestion	I'm trying to sign up for the advance account and I keep getting an error of a duplicate account
BlockCalls	Can I not receive calls from Hill correctional facility?
BlockCalls	Can you tell me why I am blocked from all correspondence at the Salina Kansas saline county jail?
BlockCalls	Cannot connect calls from inmate on the 5174553597
BlockCalls	Hello it want let me send messages it said contact not at facility when they are their
BlockCalls	I cannot get into my old email and I've been on the phone with you guys for 25 minutes I have a video session at 1:30 and nobody is answering it's been saying I'm 2 minutes from being answered for like 10 minutes and I need help my name is destiny Jeffrey pin is 1126 phone number is 863-358-7223
BlockCalls	I cannot get my message from the person that's incarcerated I don't know what's going on I don't know how I don't know what's wrong
BlockCalls	I need the website that I need to go on to ask for a refund for several video visitts n the person never showed up on them n the future ones I have set up w that person also
BlockCalls	I need to change my password an phn number stopped my telephone was stolen pls will this effect my visit for Tommy at 8 leave my phn number the same an my account is ... leahdeloach69@gmail.com the phn number was 4239460613
BlockCalls	they said i block a number?
BlockCalls	Trying to set up phone service I called the 1-800 number I can't get in touch with anyone the computer person keep on messing up on my name and and I really need help someone is calling me and I have Missfour calls from there
BlockCalls	Why am I block from sending someone a message do I have to wait for a wait period
BlockCalls	Why did the facility block
builtins.fallback	Account doesn't work
builtins.fallback	adasd
builtins.fallback	Advice
builtins.fallback	agent
builtins.fallback	Alberto Aguilar was here!
builtins.fallback	And thank you for being so rude
builtins.fallback	Ask a question
builtins.fallback	Balance
builtins.fallback	Believe I blocked a number on accident
builtins.fallback	bla
builtins.fallback	Can you find my email on file? Brooklynngrubbs95@gmail.com
builtins.fallback	Can you use chime on Securus
builtins.fallback	Can't find jail
builtins.fallback	Can't get any one by phone
builtins.fallback	Can't get video to connect right now. I missed out on 25 minutes
builtins.fallback	Can't locate inmate
builtins.fallback	Cancel visit
builtins.fallback	dasdfasdf
builtins.fallback	disputes
builtins.fallback	Do you like movies
builtins.fallback	Email address
builtins.fallback	Es pagado todo
builtins.fallback	Español ?
builtins.fallback	Habla español?
builtins.fallback	Hello
builtins.fallback	Hello !! My Bernice Riley ..I am reaching out to you guys because my husband Thaimon Terrell Crawford was recently moved from. satellite jail on Thursday and I have put money on his phone time and the money did not transfer to Jerome Kankakee jail so I am trying to find out when will I be refunded
builtins.fallback	Hello i need help
builtins.fallback	Hello I need to add money to inmate debit but the person is in joe Keegan's unit
builtins.fallback	Hello I need to remove contacts
builtins.fallback	Hello. My Brother Roger Giardini is not getting my messages sent with eMessaging. They are in my sent folder but he is not getting them. thank you
builtins.fallback	help
builtins.fallback	Henry county is not showing up but it's avaiabale now for video calls. How do I connect to them if it's not showing up in your system
builtins.fallback	Hi
builtins.fallback	Hi , I and my inmate had a video session from 4 to 4:20 today and I was there waiting but when he connected all I saw was a black screen with no sound…… he ended up messaging me on the messenger and said he could see and hear me, but I couldn't see or hear him…. We tried logging in and out about 5 times but it still never worked correctly.
builtins.fallback	Hi I'm not getting my emessages. May I know whats going on?
builtins.fallback	How do I know I'm using the rite program
builtins.fallback	how to reverse double transaction
builtins.fallback	I added funds last night to my phone and it didn't post
builtins.fallback	I agree
builtins.fallback	I am trying to find out when scheduling a video visit if I schedulate as remote , not onsite. Correct ?
builtins.fallback	I bought stamps and I didn't get any
builtins.fallback	I can't scroll far enough to click accept on terms and conditions to move forward to messages do you have any suggestions?
builtins.fallback	I get an error msg when I go to open the app. & When I go online to the website it says unreachable. I need help really bad
builtins.fallback	I keep getting a message that there is a delay and try again later
builtins.fallback	I missed two of my video visit and I was wondering if I can possibly reschedule ?
builtins.fallback	I need help with auto connect
builtins.fallback	I need to find out more about who my fiancees attorney is.
builtins.fallback	I paid what the securus lady said on the phone. Account stilo saying restrictioned
builtins.fallback	I sent my husband a response stamp n he didn't receive it
builtins.fallback	I set up visits onsite at jail to see husband and when I get to picking the date, no matter what date it is, it always says "we are experiencing technol difficulty try again later " every time for the past few weeks. He has been in for a month now and no visit yet bc of this
builtins.fallback	I want to add my phone nu
builtins.fallback	I'm having trouble finding my brother on here
builtins.fallback	I'm trying to buy stamps but it's saying that the contact is not found
builtins.fallback	Im trying to charge my phone number
builtins.fallback	Imates would like to know if they will be reibfor th
builtins.fallback	Inmate hasn't come
builtins.fallback	Inmates facility not coming out on my options
builtins.fallback	Is system down at Ozark correctional center in Fordland Missouri
builtins.fallback	It doesn't let me login
builtins.fallback	It won't let me add money
builtins.fallback	It's not logging me in
builtins.fallback	Login
builtins.fallback	Making stamp purchase for emessaging
builtins.fallback	Messages not sending
builtins.fallback	Missing stamps
builtins.fallback	My e message is blocked.
builtins.fallback	My in lobby visit was interrupted
builtins.fallback	My new account won't let me in
builtins.fallback	My number is coming up restricted from Eastern Reception and Diagnostic Center in Bonne Terre MO
builtins.fallback	My phone options
builtins.fallback	my Son has anew arrest #
builtins.fallback	My stamps are missing
builtins.fallback	My video session started at 9 and it's not connecting
builtins.fallback	My visit today at 7 . I couldn't see or hear the person I was visiting
builtins.fallback	Need help reseting my account
builtins.fallback	need to update m y phone cnumber
builtins.fallback	No one here
builtins.fallback	Not working
builtins.fallback	Other
builtins.fallback	Purchased stamps and they're not showing up
builtins.fallback	Purchasing stamps
builtins.fallback	Question about a bull
builtins.fallback	Question about commissary
CardDelete	Remove my card
builtins.fallback	Restricted question
builtins.fallback	Ronald Bonham has a visit set up in fl, it should be in Topeka Shawnee county
builtins.fallback	rus
builtins.fallback	Setting up emessageing
builtins.fallback	So I am haveing issues with this
builtins.fallback	Tablet
builtins.fallback	Tablet rental
builtins.fallback	Technical support
builtins.fallback	The site won't recognize either my email or phone number
builtins.fallback	uk address
builtins.fallback	Unable to visit
builtins.fallback	unathorized
builtins.fallback	Visitation form
builtins.fallback	Vídeo
builtins.fallback	What happens to the stamps I didn't use
builtins.fallback	what is your favorite movie
builtins.fallback	Where are my stamps?
builtins.fallback	why is it saying my phone number is not valid when I try to register for an account
builtins.fallback	Why isn't the texting predictive? I have to put in every letter. On the JPay app it was fine.
builtins.fallback	why was I charged 45.98
builtins.fallback	Why wont it let me schdual a visit for Arapahoe County
builtins.fallback	Will I receive anything by mail?
builtins.fallback	Yes my account says I'm -$17 something?! How can you go negative?
CallIssue	Call issues
CardDelete	How to I remove my credit card from my account
CustomerCareMethods	Agent
CustomerCareMethods	Customer service
CustomerCareMethods	Customer service number so I can talk to a person
